<?xml version="1.0" encoding="UTF-8"?>
<nf:project xmlns:nf="http://www.NetFPGA.org/NF2_register_system" xmlns:xsi="http://www.w3.org/2001/XMLSchema-instance" xsi:schemaLocation="http://www.NetFPGA.org/NF2_register_system NF2_register_system.xsd ">
  <nf:name>CPCI Reprogrammer</nf:name>
  <nf:description>CPCI Reprogrammer</nf:description>
  <nf:version_major>1</nf:version_major>
  <nf:version_minor>0</nf:version_minor>
  <nf:version_revision>1</nf:version_revision>
  <nf:dev_id>4</nf:dev_id>
  <nf:use_modules>
    core/nf2/generic_top
    core/nf2/reference_core
    core/cpci_bus
    core/utils
  </nf:use_modules>-
  <nf:memalloc layout="reference">
    <nf:group name="core1">
      <nf:instance name="device_id" />
    </nf:group>
  </nf:memalloc>
</nf:project>
