<?xml version="1.0" encoding="UTF-8"?>
<nf:module xmlns:nf="http://www.NetFPGA.org/NF2_register_system" xmlns:xsi="http://www.w3.org/2001/XMLSchema-instance" xsi:schemaLocation="http://www.NetFPGA.org/NF2_register_system NF2_register_system.xsd ">
	<nf:name>opl_processor</nf:name>
	<nf:prefix>opl_processor</nf:prefix>
	<nf:location>udp</nf:location>
	<nf:description>opl_processor</nf:description>
	<nf:blocksize>64</nf:blocksize>
	<nf:registers>
	</nf:registers>
	<nf:constants>
		<nf:constant>
			<nf:name>:NF2_OFPAT_OUTPUT</nf:name>
			<nf:width>:OPENFLOW_NF2_ACTION_FLAG_WIDTH</nf:width>
			<nf:value>0x0001</nf:value>
		</nf:constant>
		<nf:constant>
			<nf:name>:NF2_OFPAT_SET_VLAN_VID</nf:name>
			<nf:width>:OPENFLOW_NF2_ACTION_FLAG_WIDTH</nf:width>
			<nf:value>0x0002</nf:value>
		</nf:constant>
		<nf:constant>
			<nf:name>:NF2_OFPAT_SET_VLAN_PCP</nf:name>
			<nf:width>:OPENFLOW_NF2_ACTION_FLAG_WIDTH</nf:width>
			<nf:value>0x0004</nf:value>
		</nf:constant>
		<nf:constant>
			<nf:name>:NF2_OFPAT_STRIP_VLAN</nf:name>
			<nf:width>:OPENFLOW_NF2_ACTION_FLAG_WIDTH</nf:width>
			<nf:value>0x0008</nf:value>
		</nf:constant>
		<nf:constant>
			<nf:name>:NF2_OFPAT_SET_DL_SRC</nf:name>
			<nf:width>:OPENFLOW_NF2_ACTION_FLAG_WIDTH</nf:width>
			<nf:value>0x0010</nf:value>
		</nf:constant>
		<nf:constant>
			<nf:name>:NF2_OFPAT_SET_DL_DST</nf:name>
			<nf:width>:OPENFLOW_NF2_ACTION_FLAG_WIDTH</nf:width>
			<nf:value>0x0020</nf:value>
		</nf:constant>
		<nf:constant>
			<nf:name>:NF2_OFPAT_SET_NW_SRC</nf:name>
			<nf:width>:OPENFLOW_NF2_ACTION_FLAG_WIDTH</nf:width>
			<nf:value>0x0040</nf:value>
		</nf:constant>
		<nf:constant>
			<nf:name>:NF2_OFPAT_SET_NW_DST</nf:name>
			<nf:width>:OPENFLOW_NF2_ACTION_FLAG_WIDTH</nf:width>
			<nf:value>0x0080</nf:value>
		</nf:constant>
		<nf:constant>
			<nf:name>:NF2_OFPAT_SET_NW_TOS</nf:name>
			<nf:width>:OPENFLOW_NF2_ACTION_FLAG_WIDTH</nf:width>
			<nf:value>0x0100</nf:value>
		</nf:constant>
		<nf:constant>
			<nf:name>:NF2_OFPAT_SET_TP_SRC</nf:name>
			<nf:width>:OPENFLOW_NF2_ACTION_FLAG_WIDTH</nf:width>
			<nf:value>0x0200</nf:value>
		</nf:constant>
		<nf:constant>
			<nf:name>:NF2_OFPAT_SET_TP_DST</nf:name>
			<nf:width>:OPENFLOW_NF2_ACTION_FLAG_WIDTH</nf:width>
			<nf:value>0x0400</nf:value>
		</nf:constant>
	</nf:constants>
	<nf:types>
	</nf:types>
</nf:module>
